{
  "schemaVersion": "HostFixtureManifestV1",
  "host": "claude",
  "artifact": {
    "identity": "npm:@anthropic-ai/claude-code-linux-x64@2.1.228",
    "version": "2.1.228",
    "registryUrl": "https://registry.npmjs.org/",
    "packageIntegrity": "sha512-LMrLUYW5FY3r8wsQk/U5HWacHmxlEWKxaOgNzmDn1f5FhgKsSAPpioqf2JE5AusRRKXyWvhYM1crOE/CKIqoNQ==",
    "archiveSha256": "sha256:0c304edad9753e2efeb88ddb76c5a13c06160d67c980b9d849ad65bfadde3fd8",
    "cacheKey": "claude-code-linux-x64-2.1.228",
    "executable": {
      "path": "claude",
      "sha256": "sha256:d535985e6941a3eb00179ccd7f52ceb0c6623a0305a518ebc4e6514f84a94c99"
    }
  },
  "officialValidation": {
    "kind": "same-distribution-interface",
    "provenance": {
      "artifactIdentity": "npm:@anthropic-ai/claude-code-linux-x64@2.1.228",
      "interfacePath": "claude",
      "interfaceSha256": "sha256:d535985e6941a3eb00179ccd7f52ceb0c6623a0305a518ebc4e6514f84a94c99"
    },
    "command": ["plugin", "validate", "{pluginRoot}"]
  },
  "requiredCapabilities": ["nativeArtifactLoad"],
  "sandbox": {
    "protocolVersion": "HostSandboxLifecycleV1",
    "lifecycle": ["acquire", "verify-provenance", "install", "discover", "load", "inject-context", "attempt", "collect-receipt", "restart", "reconcile", "resume", "fork-switch", "uninstall", "audit-outputs"],
    "workRoot": ".sandbox/claude",
    "network": "disabled",
    "credentials": "disabled",
    "allowedOutputs": []
  },
  "provider": {
    "identity": "horseness-local-provider-v1",
    "requestFixture": "provider/request.json",
    "responseFixture": "provider/response.json",
    "clock": "2026-01-01T00:00:00Z",
    "budget": {"maxInputBytes": 4096, "maxOutputBytes": 4096, "maxAttempts": 1},
    "network": "disabled",
    "credentials": "disabled"
  },
  "livePolicy": {
    "credentialReference": "HORSENESS_CLAUDE_CREDENTIAL_REF",
    "publicationRequired": false,
    "timeoutMs": 30000,
    "budget": {"maxCostUsd": 0.25, "maxAttempts": 1}
  }
}
